	summarized	lineages	abundances	resid	coverage
Mixture39_barcode87	[('Other', 0.8659999999999999), ('Omicron', 0.13000000000000006), ('XBB.1.5* [Omicron (XBB.1.5.X)]', 0.002), ('BA.2.75* [Omicron (BA.2.75.X)]', 0.001), ('XBB* (XBB.X)', 0.001)]	Other XAJ BA.2.10 XAP BA.2.40.1 BA.2.63 BA.2.46 BA.2.70 XN BA.2.18 BA.2.3.12 B.3 BA.2.3 B.1.146 B.1.377 B.1.619 B.1.620 B.1.623 B.23 B.4 BA.2.13.1 BA.2.16 BA.2.2 BA.2.26 BA.2.3.14 BA.2.3.15 BA.2.3.17 BA.2.3.2 BA.2.3.5 BA.2.31 BA.2.35 BA.2.44 BA.2.48 BA.2.62 BA.2.65 BA.2.8 BA.2.9.7 BA.4.1.1 BA.4.4 BA.4.7 BA.5.1.11 BA.5.1.9 BA.5.2.23 BA.5.5.2 BF.40 BN.1.4.2 BQ.1.2.1 FY.4.1 XAK XAZ XBB.1.5.32 XBB.1.5.38 XL	0.8569999999999999 0.032 0.025 0.014 0.005 0.005 0.004 0.004 0.004 0.003 0.003 0.002 0.002 0.001 0.001 0.001 0.001 0.001 0.001 0.001 0.001 0.001 0.001 0.001 0.001 0.001 0.001 0.001 0.001 0.001 0.001 0.001 0.001 0.001 0.001 0.001 0.001 0.001 0.001 0.001 0.001 0.001 0.001 0.001 0.001 0.001 0.001 0.001 0.001 0.001 0.001 0.001 0.001		
Mixture40_barcode88	[('Other', 0.6269999999999999), ('Omicron', 0.24700000000000005), ('XBB.1.5* [Omicron (XBB.1.5.X)]', 0.12000000000000004), ('XBB* (XBB.X)', 0.003), ('BA.2.75* [Omicron (BA.2.75.X)]', 0.001), ('XBB.1.9.1* [Omicron (XBB.1.9.1.X)]', 0.001), ('XBB.2.3* (XBB.2.3X)', 0.001)]	Other BA.2.12.1 BA.2 XBB.1.5.3 BA.2.16 XAJ BA.2.23 XBB.1.5.52 XBB.1.5.79 XBB.1.5.21 XBB.1.5.66 XBB.1.5.51 BA.2.12 BA.2.37 BA.2.46 BA.2.70 XBB.1.5.30 XBB.1.5.69 BA.2.68 BA.4.7 BA.5.5.2 XBB.1.5.14 B.1.1.519 B.23 B.4 B.6 BA.2.31.1 BA.2.32 BA.2.39 BA.2.44 BA.2.48 BA.2.5 BA.2.55 BA.2.65 BA.2.71 BA.2.8 BA.2.9.7 BA.4.1.1 BA.5.1.17 BA.5.1.33 BA.5.3.2 BA.5.8 BA.5.9 BE.1.1.2 BE.1.4.1 BG.2 BM.1.1.3 BW.1.1 BW.1.1.1 EM.1 EU.1.1.1 FL.3.3 FY.4.1 XAB XBB.1.45.1 XBB.1.5.10 XBB.1.5.11 XBB.1.5.18 XBB.1.5.31 XBB.1.5.34 XBB.1.5.38 XBB.1.5.48 XBB.1.5.50 XBB.1.5.55 XBB.1.5.6 XBB.1.5.73 XBB.1.5.86 XBB.2.3.1 XBB.3 XBF.4 XW	0.6229999999999999 0.083 0.062 0.053 0.019 0.019 0.017 0.017 0.009 0.007 0.006 0.005 0.004 0.004 0.004 0.004 0.004 0.003 0.002 0.002 0.002 0.002 0.001 0.001 0.001 0.001 0.001 0.001 0.001 0.001 0.001 0.001 0.001 0.001 0.001 0.001 0.001 0.001 0.001 0.001 0.001 0.001 0.001 0.001 0.001 0.001 0.001 0.001 0.001 0.001 0.001 0.001 0.001 0.001 0.001 0.001 0.001 0.001 0.001 0.001 0.001 0.001 0.001 0.001 0.001 0.001 0.001 0.001 0.001 0.001 0.001		
Mixture41_barcode89	[('Omicron', 0.5920000000000001), ('Other', 0.2509999999999998), ('XBB* (XBB.X)', 0.08700000000000002), ('XBB.1.5* [Omicron (XBB.1.5.X)]', 0.06500000000000002), ('XBB.1.9.1* [Omicron (XBB.1.9.1.X)]', 0.002), ('Eta', 0.001), ('XBB.1.16* [Omicron (XBB.1.16.X)]', 0.001), ('XBB.2.3* (XBB.2.3X)', 0.001)]	BA.5.5 Other XBB.1 XBB.1.13 XAJ XBB.1.5.47 XBB.1.5.51 XBB.1.5.79 XBB.1.5.66 BA.2.70 XBB.1.1 XBB.1.5.30 FE.1.2 XBB.1.18.1 XBB.1.5.52 XBB.1.5.69 B.3 BA.2.13 BA.2.44 BA.2.46 BA.5.3.2 BA.5.5.2 B.23 B.4 BA.4.1.1 EM.1 FL.1 XAS XBB.1.45.1 XBB.1.5.11 XBB.1.5.23 XBB.1.5.55 XBB.3 B.1.525 B.1.619 B.39 B.40 BA.2.18 BA.2.3.17 BA.2.31 BA.2.32 BA.2.35 BA.2.39 BA.2.5 BA.2.50 BA.2.8 BA.2.9.4 BA.2.9.7 BA.4.1.8 BA.4.1.9 BA.4.7 BA.5.1.9 BA.5.8 BE.1.4.1 BE.1.4.2 BQ.1.1.71 BQ.1.9 CK.2.1.1 CP.8 EL.1 EU.1.1.1 FU.1 FY.4.1 XAK XBB.1.5.16 XBB.1.5.24 XBB.1.5.31 XBB.1.5.36 XBB.1.5.38 XBB.1.5.43 XBB.1.5.48 XBB.1.5.56 XBB.1.5.61 XBB.1.5.73 XBB.1.5.9 XBB.2.3.1	0.534 0.2409999999999998 0.054 0.015 0.011 0.009 0.008 0.008 0.006 0.005 0.005 0.005 0.004 0.004 0.004 0.004 0.003 0.003 0.003 0.003 0.003 0.003 0.002 0.002 0.002 0.002 0.002 0.002 0.002 0.002 0.002 0.002 0.002 0.001 0.001 0.001 0.001 0.001 0.001 0.001 0.001 0.001 0.001 0.001 0.001 0.001 0.001 0.001 0.001 0.001 0.001 0.001 0.001 0.001 0.001 0.001 0.001 0.001 0.001 0.001 0.001 0.001 0.001 0.001 0.001 0.001 0.001 0.001 0.001 0.001 0.001 0.001 0.001 0.001 0.001 0.001		
Mixture42_barcode90	[('Omicron', 0.97), ('Other', 0.026000000000000023), ('A', 0.004)]	BA.4.1 BA.4 Other XAJ BA.5 BA.5.3.2 BA.4.2 XAS A.1 A.2.5.2 A.27 A.3 B.1.160 B.1.620 B.23 B.6 BA.2.32 BA.2.39 BA.2.70 BA.2.9.7 BA.4.1.1 BA.4.1.8 BA.4.4 BA.4.7 BA.5.1.26 BA.5.1.9 BA.5.10.1 BA.5.6.4 BE.1.4 BE.1.4.1 BE.3 BF.16 BF.26 BV.1 BZ.2 CP.8 XAZ XB	0.69 0.229 0.02100000000000002 0.011 0.01 0.005 0.002 0.002 0.001 0.001 0.001 0.001 0.001 0.001 0.001 0.001 0.001 0.001 0.001 0.001 0.001 0.001 0.001 0.001 0.001 0.001 0.001 0.001 0.001 0.001 0.001 0.001 0.001 0.001 0.001 0.001 0.001 0.001		
NFWC_barcode91	[('Other', 0.994), ('Eta', 0.004), ('Gamma', 0.001), ('Omicron', 0.001)]	Other B.1.544 B.1.567 B.1.1.519 B.1.525 B.1.1.214 B.1.1.241 B.1.517 B.1.1.228 B.1.630 P.1.17.1 XAL	0.969 0.006 0.006 0.005 0.004 0.002 0.002 0.002 0.001 0.001 0.001 0.001		
