	summarized	lineages	abundances	resid	coverage
Mixture36_barcode36	[('Iota', 0.953), ('Other', 0.04700000000000003)]	B.1.526 Other B.1.319 B.4 B.3 B.1.1.153 B.1.377 B.1.1.232 B.1.1.376 B.1.1.434 B.1.311 B.1.361 B.1.404 B.1.517 B.1.544 B.1.619 B.1.634 B.6	0.953 0.018000000000000016 0.007 0.004 0.003 0.002 0.002 0.001 0.001 0.001 0.001 0.001 0.001 0.001 0.001 0.001 0.001 0.001		
Mixture37_barcode37	[('Delta', 0.964), ('Other', 0.03300000000000002), ('A', 0.002), ('Alpha', 0.001)]	AY.16 Other AY.54 B.4 AY.30 AY.51 B.3 A.27 A.3 AY.13 AY.14 AY.16.1 AY.17 AY.26 AY.47 AY.52 AY.53 AY.62 AY.67 AY.73 AY.8 AY.9.2 B.1.1.416 B.1.1.519 B.1.377 B.39 C.16 Q.4	0.94 0.02200000000000002 0.007 0.004 0.002 0.002 0.002 0.001 0.001 0.001 0.001 0.001 0.001 0.001 0.001 0.001 0.001 0.001 0.001 0.001 0.001 0.001 0.001 0.001 0.001 0.001 0.001 0.001		
Mixture38_barcode38	[('Omicron', 0.971), ('Other', 0.02600000000000002), ('A', 0.002), ('Eta', 0.001)]	BA.1 Other B.1.1.529 B.3 A.28 BA.1.14.1 BA.1.16.1 BA.1.5 BC.1 B.1.1.232 B.1.1.434 B.1.236 B.1.377 B.1.525 B.1.634 B.4 BA.1.1.15 BA.1.10 BA.1.15.3 BA.1.17.2 BA.1.21 BA.1.24 BA.1.7 BA.1.9 XAJ	0.942 0.016000000000000014 0.012 0.004 0.002 0.002 0.002 0.002 0.002 0.001 0.001 0.001 0.001 0.001 0.001 0.001 0.001 0.001 0.001 0.001 0.001 0.001 0.001 0.001 0.001		
Mixture39_barcode39	[('Other', 0.9349999999999999), ('Omicron', 0.062000000000000034), ('A', 0.003)]	Other XAJ BA.2.18 BA.2.40.1 BA.2.46 BA.2.54 B.3 BA.2.3.17 BA.2.44 BA.2.70 BA.2.9.7 BA.4.7 A.27 A.28 A.3 B.1.1.434 B.1.620 B.23 BA.2.13.1 BA.2.16 BA.2.2 BA.2.3.4 BA.2.31 BA.2.32 BA.2.35 BA.2.39 BA.2.41 BA.2.49 BA.2.55 BA.2.62 BA.2.64 BA.2.65 BA.2.67 BA.2.74 BA.2.8 BA.4.1.1 BA.5.1.33 BA.5.5.2 BE.1.4.1 BF.7.4.2 BK.1 BW.1.1.1 BW.1.1.2 L.3 XAP XAZ XW	0.9279999999999999 0.007 0.005 0.004 0.004 0.004 0.003 0.002 0.002 0.002 0.002 0.002 0.001 0.001 0.001 0.001 0.001 0.001 0.001 0.001 0.001 0.001 0.001 0.001 0.001 0.001 0.001 0.001 0.001 0.001 0.001 0.001 0.001 0.001 0.001 0.001 0.001 0.001 0.001 0.001 0.001 0.001 0.001 0.001 0.001 0.001 0.001		
Mixture40_barcode40	[('Omicron', 0.968), ('Other', 0.03000000000000002), ('A', 0.001), ('XBB.2.3* (XBB.2.3X)', 0.001)]	BA.2.12.1 Other XAJ XAP B.3 B.4 BA.2.29 BE.1.4.1 A.28 B.1.1.434 B.1.1.519 B.23 BA.2.26 BA.2.3.17 BA.2.31.1 BA.2.35 BA.2.9.7 BA.5.1.11 BA.5.1.26 BA.5.5.2 BA.5.9 BQ.1.4 DG.1 XBB.2.3.1 XBT	0.942 0.02200000000000002 0.005 0.005 0.003 0.002 0.002 0.002 0.001 0.001 0.001 0.001 0.001 0.001 0.001 0.001 0.001 0.001 0.001 0.001 0.001 0.001 0.001 0.001 0.001		
Mixture41_barcode41	[('Omicron', 0.9640000000000001), ('Other', 0.03499999999999992), ('A', 0.001)]	BA.5.5 BA.5.3 Other BA.5.3.4 BA.5.8 B.3 BA.5.3.2 BE.1 CP.8 A.27 B.1.620 BA.5.1.11 BA.5.1.33 BA.5.1.9 BA.5.10.1 BA.5.11 BA.5.2.31 BA.5.2.60 BA.5.2.8 BE.1.2 BE.1.4.1 BE.12 BE.3 BF.27 BF.36 BQ.1.1.28 BQ.1.13.1 BQ.1.2.1 BQ.1.9 BU.1 BV.1 BW.1.1 BZ.2 CQ.1.1 XAJ XAZ	0.803 0.12 0.030999999999999917 0.004 0.004 0.003 0.003 0.003 0.002 0.001 0.001 0.001 0.001 0.001 0.001 0.001 0.001 0.001 0.001 0.001 0.001 0.001 0.001 0.001 0.001 0.001 0.001 0.001 0.001 0.001 0.001 0.001 0.001 0.001 0.001 0.001		
Mixture42_barcode42	[('Omicron', 0.969), ('Other', 0.028000000000000025), ('A', 0.003)]	BA.4.1 BA.4 Other XAJ BA.2.70 BA.5 BA.2.46 B.3 BA.2.44 BE.1.4.1 A.27 A.28 A.3 B.1.1.434 B.1.544 BA.2.13.1 BA.2.21 BA.2.3.17 BA.2.35 BA.2.39 BA.2.49 BA.2.67 BA.2.8 BA.2.9.7 BA.4.1.1 BA.4.1.6 BA.4.1.8 BA.4.2 BA.4.4 BA.4.7 BA.5.1.26 BA.5.1.33 BA.5.1.9 BA.5.2.25 BA.5.5.2 BA.5.8 BE.4.2 BF.11.5 BF.7.4.2 BG.5 BW.1.1.1 CN.2 CP.8 XB XW	0.709 0.203 0.02300000000000002 0.011 0.005 0.005 0.003 0.002 0.002 0.002 0.001 0.001 0.001 0.001 0.001 0.001 0.001 0.001 0.001 0.001 0.001 0.001 0.001 0.001 0.001 0.001 0.001 0.001 0.001 0.001 0.001 0.001 0.001 0.001 0.001 0.001 0.001 0.001 0.001 0.001 0.001 0.001 0.001 0.001 0.001		
NFWC_barcode43	[('Other', 0.866), ('Omicron', 0.128), ('Delta', 0.006)]	Other BA.1.1.3 B.1.1.519 B.1.634 B.1.620 B.1.1.529 AY.4.1 BA.2.67 XB B.1.36.38 B.1.626 XAY.1.1.1	0.6920000000000001 0.103 0.076 0.061 0.03 0.019 0.006 0.006 0.003 0.002 0.001 0.001		
