	summarized	lineages	abundances	resid	coverage
Mixture01_barcode01	[('Omicron', 0.6010000000000001), ('Other', 0.2169999999999999), ('Alpha', 0.058), ('Iota', 0.046), ('Gamma', 0.044000000000000004), ('Delta', 0.031000000000000014), ('A', 0.001), ('Epsilon', 0.001), ('Eta', 0.001)]	BA.4.1 B.1.1.161 BA.2.12 Other XAJ B.1.1.7 B.1.526 BA.5.5 BF.1 P.1 XAR XAP AY.8 BA.1.14 BF.40 P.1.16 BA.1.1.1 BF.20 BA.2.18 BA.2.40.1 B.1.1.216 BA.2.70 AY.51 AY.54 B.1.377 B.3 B.4 BA.1.15.3 BA.5.2.9 BF.10 BF.2 BF.27 P.1.13 XAB A.28 AY.13 AY.16 AY.16.1 AY.17 AY.30 AY.35 AY.52 AY.53 AY.9.2 B.1.1.228 B.1.1.232 B.1.1.297 B.1.1.329 B.1.1.368 B.1.1.376 B.1.1.416 B.1.1.67 B.1.1.70 B.1.110 B.1.429 B.1.471 B.1.525 B.1.544 B.1.575 B.1.617.2 B.1.619 B.1.625 B.1.9 B.39 B.6 BA.1.1.3 BA.1.20 BA.1.24 BA.1.5 BA.1.7 BA.2.3.15 BA.2.31.1 BA.2.35 BA.2.39 BA.2.8 BA.4.1.1 BA.4.1.8 BA.5.1.26 BA.5.1.9 BA.5.11 BA.5.2.30 BA.5.2.8 BA.5.5.2 BA.5.6 BA.5.8 BE.1.4.2 BF.21 BF.3.1 BF.31 BF.36 BF.5 CL.1.1 CM.4 P.1.14 P.1.15 P.1.6 P.1.7 Q.1 Q.3 Q.4 Q.7 XAD	0.22 0.099 0.093 0.09099999999999986 0.071 0.054 0.046 0.043 0.037 0.03 0.025 0.022 0.017 0.014 0.013 0.008 0.006 0.005 0.004 0.004 0.003 0.003 0.002 0.002 0.002 0.002 0.002 0.002 0.002 0.002 0.002 0.002 0.002 0.002 0.001 0.001 0.001 0.001 0.001 0.001 0.001 0.001 0.001 0.001 0.001 0.001 0.001 0.001 0.001 0.001 0.001 0.001 0.001 0.001 0.001 0.001 0.001 0.001 0.001 0.001 0.001 0.001 0.001 0.001 0.001 0.001 0.001 0.001 0.001 0.001 0.001 0.001 0.001 0.001 0.001 0.001 0.001 0.001 0.001 0.001 0.001 0.001 0.001 0.001 0.001 0.001 0.001 0.001 0.001 0.001 0.001 0.001 0.001 0.001 0.001 0.001 0.001 0.001 0.001 0.001 0.001 0.001		
Mixture02_barcode02	[('Other', 0.39), ('Alpha', 0.261), ('Iota', 0.114), ('Delta', 0.10500000000000001), ('Omicron', 0.07600000000000001), ('Gamma', 0.049), ('A', 0.005)]	B.1.1.7 Other B.1.1.161 B.1.526 AY.16 BA.1 P.1 P.1.16 B.4 P.1.13 B.3 AY.47 BA.1.15.3 Q.4 A.1 A.23.1 A.27 A.28 A.3 AY.16.1 AY.17 AY.30 AY.51 AY.52 AY.53 AY.54 AY.62 B.1.1.228 B.1.1.277 B.1.1.284 B.1.1.519 B.1.1.521 B.1.1.70 B.1.214.2 B.1.617.2 B.1.619 B.39 B.6 BA.1.1.1 BA.1.1.15 BA.1.10 BA.1.14.1 BA.1.15.2 BA.1.16.1 BA.1.17.2 BA.1.24 BA.1.5 BA.1.7 BA.1.9 BC.1 C.35 D.2 P.1.10.1 P.1.14 P.1.15 Q.7	0.258 0.21799999999999997 0.152 0.114 0.094 0.062 0.034 0.008 0.005 0.004 0.003 0.002 0.002 0.002 0.001 0.001 0.001 0.001 0.001 0.001 0.001 0.001 0.001 0.001 0.001 0.001 0.001 0.001 0.001 0.001 0.001 0.001 0.001 0.001 0.001 0.001 0.001 0.001 0.001 0.001 0.001 0.001 0.001 0.001 0.001 0.001 0.001 0.001 0.001 0.001 0.001 0.001 0.001 0.001 0.001 0.001		
Mixture03_barcode03	[('Omicron', 0.962), ('Other', 0.03700000000000002), ('A', 0.001)]	BA.2.38 BA.2.12 Other BQ.1.9 BA.2.73 BA.5.3.2 B.3 BA.2.37 BA.2.39 BA.2.40.1 BA.2.46 BA.2.68 BF.10 B.1.609 BA.2.16 BA.2.34 BA.2.63 BA.2.67 BA.2.7 BA.2.9.4 BA.5.2.39 BA.5.8 BF.36 XAS A.1 B.1.1.207 B.1.1.241 B.1.221 B.1.260 B.1.36.1 B.1.395 B.1.409 B.1.544 B.1.561 B.39 BA.2.1 BA.2.13.1 BA.2.2 BA.2.25 BA.2.26 BA.2.3.4 BA.2.31.1 BA.2.32 BA.2.35 BA.2.48 BA.2.62 BA.2.70 BA.4.1.8 BA.4.7 BA.5.1.27 BA.5.1.7 BA.5.5.2 BA.5.6.4 BA.5.9 BF.29 BF.7.5.1 BQ.1.4 CN.2 CQ.1.1 DN.2 ER.1.1 XB XBT XE XQ	0.813 0.065 0.021000000000000008 0.008 0.005 0.004 0.003 0.003 0.003 0.003 0.003 0.003 0.003 0.002 0.002 0.002 0.002 0.002 0.002 0.002 0.002 0.002 0.002 0.002 0.001 0.001 0.001 0.001 0.001 0.001 0.001 0.001 0.001 0.001 0.001 0.001 0.001 0.001 0.001 0.001 0.001 0.001 0.001 0.001 0.001 0.001 0.001 0.001 0.001 0.001 0.001 0.001 0.001 0.001 0.001 0.001 0.001 0.001 0.001 0.001 0.001 0.001 0.001 0.001 0.001		
Mixture04_barcode04	[('Omicron', 0.4100000000000001), ('Other', 0.24299999999999988), ('Gamma', 0.162), ('Iota', 0.121), ('Alpha', 0.062), ('Eta', 0.001), ('BA.2.75* [Omicron (BA.2.75.X)]', 0.001)]	BA.2 B.1.1.161 P.1 B.1.526 Other B.1.1.7 BA.1.18 XAJ BA.1.17.2 P.1.16 BA.2.23 XAR XAB BA.2.70 XM BA.1.1.1 BA.2.18 BA.2.54 B.4 BA.2.40.1 BA.2.46 P.1.13 B.3 BA.1.16.1 BA.2.2 BA.2.23.1 BA.2.63 BA.2.65 B.1.1.39 B.1.1.434 B.1.221 B.1.311 B.1.340 B.1.36.31 B.1.361 B.1.465 B.1.525 B.1.568 B.23 B.39 BA.1.1.3 BA.1.1.4 BA.1.10 BA.1.14.1 BA.1.15.2 BA.1.20 BA.1.5 BA.1.7 BA.2.1 BA.2.12 BA.2.13.1 BA.2.16 BA.2.3.14 BA.2.3.15 BA.2.3.17 BA.2.3.2 BA.2.3.4 BA.2.3.6 BA.2.31 BA.2.39 BA.2.5 BA.2.62 BA.2.9.7 BD.1 BN.1.3.7 P.1.14 P.1.15 P.1.17.1 P.1.7 Q.3 Q.4 Q.7 XAL XB	0.161 0.125 0.125 0.121 0.10099999999999987 0.059 0.052 0.048 0.041 0.03 0.017 0.017 0.008 0.006 0.006 0.005 0.004 0.004 0.003 0.003 0.003 0.003 0.002 0.002 0.002 0.002 0.002 0.002 0.001 0.001 0.001 0.001 0.001 0.001 0.001 0.001 0.001 0.001 0.001 0.001 0.001 0.001 0.001 0.001 0.001 0.001 0.001 0.001 0.001 0.001 0.001 0.001 0.001 0.001 0.001 0.001 0.001 0.001 0.001 0.001 0.001 0.001 0.001 0.001 0.001 0.001 0.001 0.001 0.001 0.001 0.001 0.001 0.001 0.001		
Mixture05_barcode05	[('Omicron', 0.5830000000000001), ('Other', 0.4149999999999999), ('A', 0.002)]	Other BA.4.1 B.1.1.161 BA.5.5 BF.1 XAJ BA.2.12 BA.5.11 XZ BF.15 XAP BA.2.70 BA.5.2.2 BA.5.8 BF.10 B.4 B.6 BA.5.1.17 BA.5.10.1 BF.2 BF.27 BF.31 XAZ A.1 A.28 AD.2 B.23 BA.2.13.1 BA.2.26 BA.2.29 BA.2.32 BA.2.39 BA.2.8 BA.2.9.7 BA.4.1.6 BA.4.1.8 BA.4.4 BA.4.7 BA.5.1.21 BA.5.1.26 BA.5.1.9 BA.5.5.2 BE.1.4.1 BE.3 BF.1.1 BF.21 BF.3.1 BF.40 BF.41 BF.7.5.1 BF.8 BF.9 BG.2 BV.1 CQ.1.1	0.2679999999999999 0.234 0.141 0.09 0.071 0.067 0.037 0.014 0.006 0.005 0.005 0.004 0.004 0.003 0.003 0.002 0.002 0.002 0.002 0.002 0.002 0.002 0.002 0.001 0.001 0.001 0.001 0.001 0.001 0.001 0.001 0.001 0.001 0.001 0.001 0.001 0.001 0.001 0.001 0.001 0.001 0.001 0.001 0.001 0.001 0.001 0.001 0.001 0.001 0.001 0.001 0.001 0.001 0.001 0.001		
Mixture06_barcode06	[('Omicron', 0.5990000000000001), ('Delta', 0.128), ('Alpha', 0.08), ('Gamma', 0.067), ('Other', 0.06299999999999993), ('Iota', 0.059), ('A', 0.002), ('Epsilon', 0.001), ('Eta', 0.001)]	AY.8 BA.2.12.1 BA.2.12 BA.1 XAJ B.1.1.7 BA.2.11 B.1.526 P.1 BA.1.9 XAB XM Other XAP B.1.617.2 BA.2.23 P.1.16 BA.2 B.1.1.220 BA.2.18 BA.5.3.2 P.1.13 P.1.4 B.1.1.228 B.3 BA.2.40.1 AY.16.1 AY.57 B.1.1.216 B.1.1.231 B.1.1.329 B.1.260 B.4 BA.1.10 BA.1.16.1 BA.2.29 BA.2.39 BA.2.46 BA.2.63 P.1.7 A.23.1 A.3 AY.13 AY.132 AY.14 AY.17 AY.30 AY.35 AY.4.8 AY.51 AY.52 AY.87 AZ.3 B.1.1.115 B.1.1.161 B.1.1.232 B.1.1.269 B.1.1.294 B.1.1.316 B.1.1.317 B.1.1.376 B.1.1.434 B.1.1.70 B.1.221 B.1.362 B.1.377 B.1.429 B.1.525 B.1.544 B.1.568 B.1.620 B.6 BA.1.15.3 BA.1.17.2 BA.1.24 BA.1.5 BA.2.1 BA.2.16 BA.2.2 BA.2.26 BA.2.3.4 BA.2.32 BA.2.35 BA.2.48 BA.2.5 BA.2.50 BA.2.55 BA.2.65 BA.2.70 BA.2.8 BA.4.1.1 BA.4.7 BA.5.1.9 BA.5.8 BA.5.9 BC.1 BE.1.4.1 BF.11.5 BF.27 BF.7.7 BG.2 BG.5 DF.1.1 L.3 P.1.1 P.1.14 P.1.15 P.1.17.1 P.1.6 Q.4 Q.7	0.105 0.096 0.094 0.08 0.08 0.078 0.071 0.059 0.044 0.04 0.036 0.024 0.02399999999999991 0.011 0.009 0.008 0.008 0.005 0.004 0.004 0.004 0.004 0.004 0.003 0.003 0.003 0.002 0.002 0.002 0.002 0.002 0.002 0.002 0.002 0.002 0.002 0.002 0.002 0.002 0.002 0.001 0.001 0.001 0.001 0.001 0.001 0.001 0.001 0.001 0.001 0.001 0.001 0.001 0.001 0.001 0.001 0.001 0.001 0.001 0.001 0.001 0.001 0.001 0.001 0.001 0.001 0.001 0.001 0.001 0.001 0.001 0.001 0.001 0.001 0.001 0.001 0.001 0.001 0.001 0.001 0.001 0.001 0.001 0.001 0.001 0.001 0.001 0.001 0.001 0.001 0.001 0.001 0.001 0.001 0.001 0.001 0.001 0.001 0.001 0.001 0.001 0.001 0.001 0.001 0.001 0.001 0.001 0.001 0.001 0.001 0.001		
Mixture07_barcode07	[('Omicron', 0.561), ('Alpha', 0.15), ('Iota', 0.129), ('Gamma', 0.08), ('Other', 0.07900000000000006), ('A', 0.001)]	BA.4.1 B.1.1.7 B.1.526 BF.1 XAJ P.1 BA.5.5 BA.2.12 XAP Other P.1.16 B.1.1.161 B.1.533 BA.5.2.2 B.1.1.228 XAR B.1.1.220 B.1.1.153 B.1.1.216 B.1.1.231 BA.5.5.2 BF.2 BF.40 P.1.13 P.1.7 A.28 AD.2 B.1.1.135 B.1.1.170 B.1.1.174 B.1.1.186 B.1.1.207 B.1.1.232 B.1.1.265 B.1.1.269 B.1.1.274 B.1.1.294 B.1.1.329 B.1.1.33 B.1.1.348 B.1.1.374 B.1.1.376 B.1.1.416 B.1.1.432 B.1.1.434 B.1.1.464 B.1.1.70 B.1.258.17 B.1.568 B.1.596.1 B.1.623 BA.4.3 BA.4.7 BA.5.1.33 BA.5.1.9 BA.5.2.9 BA.5.5.3 BA.5.6.4 BE.1.4.2 BF.1.1 BF.10 BF.11.1 BF.15 BF.16 BF.21 BF.3.1 BF.36 BF.5 BF.9 BQ.1.1.28 C.35 CL.1.1 CP.8 CR.1.1 D.2 L.3 P.1.1 P.1.15 P.1.6 Q.4 Q.7 XH XL	0.258 0.148 0.129 0.081 0.081 0.062 0.037 0.034 0.03 0.020000000000000018 0.011 0.01 0.008 0.006 0.004 0.004 0.003 0.002 0.002 0.002 0.002 0.002 0.002 0.002 0.002 0.001 0.001 0.001 0.001 0.001 0.001 0.001 0.001 0.001 0.001 0.001 0.001 0.001 0.001 0.001 0.001 0.001 0.001 0.001 0.001 0.001 0.001 0.001 0.001 0.001 0.001 0.001 0.001 0.001 0.001 0.001 0.001 0.001 0.001 0.001 0.001 0.001 0.001 0.001 0.001 0.001 0.001 0.001 0.001 0.001 0.001 0.001 0.001 0.001 0.001 0.001 0.001 0.001 0.001 0.001 0.001 0.001 0.001		
Mixture08_barcode08	[('Omicron', 0.9650000000000001), ('Other', 0.03199999999999969), ('A', 0.002), ('Beta', 0.001)]	BA.5.5 BA.4.1 BA.1 BA.2 BA.2.12 XQ BA.2.12.1 Other XAP BA.4 BE.1 BA.5.1.26 XAJ BA.2.37 BA.5.5.2 BA.2.54 BA.2.70 B.3 BA.1.13 BA.2.29 BA.4.7 BA.5.2.2 BA.5.8 BC.1 B.1.260 BA.1.15.3 BA.2.16 BA.2.18 BA.2.2 BA.2.26 BA.2.32 BA.2.34 BA.2.40.1 BA.2.44 BA.2.46 BA.2.67 BA.2.68 BA.5.1.21 BA.5.2.30 XS XZ A.23.1 A.28 B.1.1.434 B.1.1.529 B.1.221 B.1.351 B.1.377 B.1.391 B.1.544 B.1.620 B.1.623 B.1.634 BA.1.1.4 BA.1.10 BA.1.16.1 BA.1.17.2 BA.1.24 BA.1.5 BA.1.7 BA.2.1 BA.2.25 BA.2.3.12 BA.2.3.14 BA.2.3.17 BA.2.3.2 BA.2.3.4 BA.2.31.1 BA.2.39 BA.2.41 BA.2.48 BA.2.50 BA.2.7 BA.2.71 BA.2.8 BA.2.9.7 BA.4.1.6 BA.4.1.8 BA.4.2 BA.4.6.5 BA.5.1.16 BA.5.1.33 BA.5.1.9 BA.5.10.1 BA.5.2.4 BA.5.6.1 BA.5.6.4 BA.5.9 BE.1.1.1 BE.1.4 BE.1.4.1 BE.3 BF.11.5 BF.16 BF.36 BG.2 BG.5 BK.1 BZ.2 CQ.1.1 XAZ XBT XL	0.258 0.17 0.14 0.075 0.065 0.061 0.034 0.016999999999999682 0.014 0.011 0.008 0.006 0.006 0.005 0.005 0.004 0.004 0.003 0.003 0.003 0.003 0.003 0.003 0.003 0.002 0.002 0.002 0.002 0.002 0.002 0.002 0.002 0.002 0.002 0.002 0.002 0.002 0.002 0.002 0.002 0.002 0.001 0.001 0.001 0.001 0.001 0.001 0.001 0.001 0.001 0.001 0.001 0.001 0.001 0.001 0.001 0.001 0.001 0.001 0.001 0.001 0.001 0.001 0.001 0.001 0.001 0.001 0.001 0.001 0.001 0.001 0.001 0.001 0.001 0.001 0.001 0.001 0.001 0.001 0.001 0.001 0.001 0.001 0.001 0.001 0.001 0.001 0.001 0.001 0.001 0.001 0.001 0.001 0.001 0.001 0.001 0.001 0.001 0.001 0.001 0.001 0.001 0.001		
Mixture09_barcode09	[('Other', 0.997), ('A', 0.003)]	Other B.3 A.1 A.27 A.3 B.1.1.153 B.1.1.434	0.993 0.002 0.001 0.001 0.001 0.001 0.001		
Mixture10_barcode10	[('Omicron', 0.9700000000000001), ('Other', 0.028999999999999915), ('Alpha', 0.001)]	BA.2 BA.1 BA.1.6 Other XAP XAR BA.2.29 XAD BA.1.10 BA.2.46 BA.2.63 XAJ B.1.1.153 B.3 BA.2.16 BA.2.18 BA.2.40.1 BA.2.44 BA.2.54 BA.2.70 AD.2 B.1.1.434 B.1.1.529 B.1.260 B.1.377 B.1.544 B.1.575 B.1.620 B.39 B.4 BA.1.1.15 BA.1.1.4 BA.1.15.2 BA.1.24 BA.1.9 BA.2.10.1 BA.2.13 BA.2.13.1 BA.2.2 BA.2.3.4 BA.2.31 BA.2.32 BA.2.35 BA.2.42 BA.2.48 BA.2.5 BA.2.50 BA.2.62 BA.2.65 BA.2.8 BA.5.1.9 BC.1 BF.40 Q.4 XAL XE XS	0.635 0.239 0.017 0.014999999999999902 0.012 0.009 0.004 0.004 0.003 0.003 0.003 0.003 0.002 0.002 0.002 0.002 0.002 0.002 0.002 0.002 0.001 0.001 0.001 0.001 0.001 0.001 0.001 0.001 0.001 0.001 0.001 0.001 0.001 0.001 0.001 0.001 0.001 0.001 0.001 0.001 0.001 0.001 0.001 0.001 0.001 0.001 0.001 0.001 0.001 0.001 0.001 0.001 0.001 0.001 0.001 0.001 0.001		
Mixture11_barcode11	[('Omicron', 0.965), ('Other', 0.03200000000000003), ('A', 0.002), ('XBB.1.9.1* [Omicron (XBB.1.9.1.X)]', 0.001)]	BA.2.12.1 Other XAJ B.6 BA.5.5.2 A.28 A.29 B.1.1.434 B.23 B.3 B.39 B.4 B.40 BA.2.26 BA.2.3.4 BA.2.32 BA.4.7 BA.5.1.9 BA.5.6.4 BA.5.8 BG.2 BG.5 DF.1.1 FL.3.3 XAZ	0.944 0.02400000000000002 0.008 0.002 0.002 0.001 0.001 0.001 0.001 0.001 0.001 0.001 0.001 0.001 0.001 0.001 0.001 0.001 0.001 0.001 0.001 0.001 0.001 0.001 0.001		
Mixture12_barcode12	[('Omicron', 0.967), ('Other', 0.030000000000000027), ('A', 0.003)]	BF.1 BA.5.5 Other BA.5.3 BA.5.1.26 BA.5.3.2 BA.5.8 BE.1.1.1 XAJ B.3 BE.1.4.1 BU.1 A.23.1 A.27 A.28 B.1.619 B.23 B.39 B.4 B.40 BA.5.1.11 BA.5.1.21 BA.5.1.33 BA.5.1.4 BA.5.1.9 BA.5.10.1 BA.5.2.7 BA.5.5.2 BE.1.2 BE.10 BF.1.1 BF.21 BF.27 BF.36 BK.1 BQ.1.4 BQ.1.9 BU.3 BW.1.1 BZ.2 CL.1 CN.2 CP.8 CQ.1.1 D.2 DR.2 L.3 XAZ XBD XBT	0.688 0.216 0.02100000000000002 0.013 0.006 0.003 0.003 0.003 0.003 0.002 0.002 0.002 0.001 0.001 0.001 0.001 0.001 0.001 0.001 0.001 0.001 0.001 0.001 0.001 0.001 0.001 0.001 0.001 0.001 0.001 0.001 0.001 0.001 0.001 0.001 0.001 0.001 0.001 0.001 0.001 0.001 0.001 0.001 0.001 0.001 0.001 0.001 0.001 0.001 0.001		
Mixture13_barcode13	[('Omicron', 0.967), ('Other', 0.02800000000000002), ('A', 0.004), ('XBB.2.3* (XBB.2.3X)', 0.001)]	BA.4.1 BA.4 Other XAJ BA.5 BA.2.70 B.3 BA.2.46 BA.4.4 A.23.1 A.27 A.28 A.3 B.1.620 B.23 BA.2.1 BA.2.3.17 BA.2.3.4 BA.2.31 BA.2.35 BA.2.39 BA.2.48 BA.2.49 BA.2.67 BA.2.8 BA.4.1.1 BA.4.3 BA.4.7 BA.5.1.26 BA.5.1.33 BA.5.5.2 BE.1.4.1 BF.32 BF.36 BQ.1.1.28 BW.1.1.2 CN.2 XAS XAZ XBB.2.3.1 XH XL XM XW	0.705 0.208 0.02300000000000002 0.009 0.007 0.005 0.003 0.003 0.002 0.001 0.001 0.001 0.001 0.001 0.001 0.001 0.001 0.001 0.001 0.001 0.001 0.001 0.001 0.001 0.001 0.001 0.001 0.001 0.001 0.001 0.001 0.001 0.001 0.001 0.001 0.001 0.001 0.001 0.001 0.001 0.001 0.001 0.001 0.001		
Mixture14_barcode14	[('Other', 0.997), ('A', 0.002), ('Alpha', 0.001)]	Other A.1 A.23.1 B.1.1.153 B.1.1.434 B.4 Q.4	0.994 0.001 0.001 0.001 0.001 0.001 0.001		
Mixture15_barcode15	[('Alpha', 0.965), ('Other', 0.03400000000000002), ('A', 0.001)]	B.1.1.7 Other B.1.1.161 B.1.1.153 B.3 A.28 B.1.1.416 B.1.1.434 B.1.544 B.1.620 B.39 B.4 L.3 Q.4 Q.7	0.963 0.019000000000000017 0.004 0.002 0.002 0.001 0.001 0.001 0.001 0.001 0.001 0.001 0.001 0.001 0.001		
Mixture16_barcode16	[('Gamma', 0.964), ('Other', 0.03100000000000002), ('A', 0.004), ('Eta', 0.001)]	P.1 Other P.1.13 B.1.1.153 B.3 B.4 A.1 A.2.5.2 A.28 A.29 B.1.1.216 B.1.1.329 B.1.1.416 B.1.1.434 B.1.1.464 B.1.1.70 B.1.377 B.1.409 B.1.525 B.1.544 B.1.620 B.6 C.16 P.1.10.1 P.1.16 P.1.17.1	0.958 0.013000000000000012 0.003 0.002 0.002 0.002 0.001 0.001 0.001 0.001 0.001 0.001 0.001 0.001 0.001 0.001 0.001 0.001 0.001 0.001 0.001 0.001 0.001 0.001 0.001 0.001		
Mixture17_barcode17	[('Iota', 0.962), ('Other', 0.03700000000000003), ('A', 0.001)]	B.1.526 Other B.1.1.153 B.3 B.4 A.28 B.1.1.232 B.1.1.434 B.1.160 B.1.221 B.1.377 B.1.509 B.1.623 B.39 B.55 B.6 D.2	0.962 0.020000000000000018 0.002 0.002 0.002 0.001 0.001 0.001 0.001 0.001 0.001 0.001 0.001 0.001 0.001 0.001 0.001		
Mixture18_barcode18	[('Delta', 0.968), ('Other', 0.03000000000000002), ('A', 0.002)]	AY.16 Other B.4 AY.54 AY.16.1 AY.47 A.1 A.3 AY.13 AY.17 AY.30 AY.35 AY.51 AY.52 AY.53 AY.62 B.1.1.153 B.1.1.416 B.1.236 B.1.404 B.1.619 B.3 C.16	0.951 0.013000000000000012 0.01 0.005 0.002 0.002 0.001 0.001 0.001 0.001 0.001 0.001 0.001 0.001 0.001 0.001 0.001 0.001 0.001 0.001 0.001 0.001 0.001		
Mixture19_barcode19	[('Omicron', 0.971), ('Other', 0.02700000000000002), ('A', 0.002)]	BA.1 Other BA.1.6 B.3 A.2.5.2 A.28 B.1.1.153 B.1.1.434 B.1.377 B.1.619 B.1.620 B.1.634 BA.1.1.15 BA.1.1.4 BA.1.13 BA.1.16.1 BA.1.17.2 BA.1.20 BA.1.5 BA.1.7 BA.1.9	0.951 0.018000000000000016 0.011 0.003 0.001 0.001 0.001 0.001 0.001 0.001 0.001 0.001 0.001 0.001 0.001 0.001 0.001 0.001 0.001 0.001 0.001		
Mixture20_barcode20	[('Other', 0.9349999999999999), ('Omicron', 0.06300000000000003), ('A', 0.001), ('Alpha', 0.001)]	Other XAJ BA.2.18 BA.2.46 BA.2.68 BA.5 BA.2.29 BA.2.3.17 BA.2.40.1 BA.2.70 XAB A.27 B.1.1.161 B.1.544 B.23 B.3 BA.2.13.1 BA.2.16 BA.2.2 BA.2.26 BA.2.3.12 BA.2.31 BA.2.31.1 BA.2.32 BA.2.35 BA.2.39 BA.2.41 BA.2.44 BA.2.48 BA.2.50 BA.2.55 BA.2.65 BA.2.9.7 BA.4.1.6 BA.4.1.8 BA.5.5.2 BA.5.8 BE.1.4.1 BF.36 BF.7.4.2 BW.1.1 CN.2 CP.8 Q.4 XAZ XE XW	0.9309999999999999 0.007 0.006 0.004 0.003 0.003 0.002 0.002 0.002 0.002 0.002 0.001 0.001 0.001 0.001 0.001 0.001 0.001 0.001 0.001 0.001 0.001 0.001 0.001 0.001 0.001 0.001 0.001 0.001 0.001 0.001 0.001 0.001 0.001 0.001 0.001 0.001 0.001 0.001 0.001 0.001 0.001 0.001 0.001 0.001 0.001 0.001		
Mixture21_barcode21	[('Other', 0.999), ('A', 0.001)]	Other B.4 B.3 A.27 B.39 B.40	0.992 0.003 0.002 0.001 0.001 0.001		
Mixture22_barcode22	[('Omicron', 0.971), ('Other', 0.028000000000000018), ('A', 0.001)]	BA.2.12.1 Other XAJ B.4 B.3 BG.2 A.2.5.2 B.1.160.16 B.1.620 B.39 B.6 BA.2.3.11 BA.2.31.1 BA.2.55 BA.2.70 BA.2.9.7 BA.4.7 BA.5.1.33 BA.5.5.2 BA.5.6.4 BA.5.8 BE.1.4.1 BG.4 BG.5 BW.1.1.2 XAZ XL XW	0.942 0.018000000000000016 0.01 0.004 0.002 0.002 0.001 0.001 0.001 0.001 0.001 0.001 0.001 0.001 0.001 0.001 0.001 0.001 0.001 0.001 0.001 0.001 0.001 0.001 0.001 0.001 0.001 0.001		
Mixture23_barcode23	[('Omicron', 0.969), ('Other', 0.027000000000000014), ('A', 0.002), ('Epsilon', 0.001), ('XBB.1.9.1* [Omicron (XBB.1.9.1.X)]', 0.001)]	BA.2.12.1 Other XAJ B.4 B.3 BA.2.29 A.27 A.28 B.1.1.434 B.1.429 B.1.619 B.6 BA.2.31.1 BA.2.70 BA.2.9.7 BA.4.7 BA.5.1.26 BA.5.1.9 BE.1.4.1 BF.7.7 BG.4 BG.5 FL.3.3 XAZ XBT	0.947 0.015000000000000013 0.008 0.006 0.003 0.002 0.001 0.001 0.001 0.001 0.001 0.001 0.001 0.001 0.001 0.001 0.001 0.001 0.001 0.001 0.001 0.001 0.001 0.001 0.001		
Mixture24_barcode24	[('Omicron', 0.9660000000000001), ('Other', 0.03299999999999992), ('A', 0.001)]	BF.1 Other BA.5.8 BA.5.3.4 B.3 BA.5.2.4 BA.5.3.2 BE.1.4.1 BF.10 CP.8 A.28 B.1.1.434 B.1.236 B.1.377 B.1.620 B.23 BA.5.1.26 BA.5.1.33 BA.5.1.5 BA.5.10.1 BA.5.2.8 BA.5.5.1 BF.1.1 BF.11.4 BF.26 BF.27 BF.31 BF.41 BF.5 BF.7.5.1 BF.7.7 BQ.1.13.1 BQ.1.2.1 BU.1 BV.1 BZ.2 CD.2 CN.2 CR.1.1 XAZ	0.925 0.025999999999999912 0.004 0.003 0.002 0.002 0.002 0.002 0.002 0.002 0.001 0.001 0.001 0.001 0.001 0.001 0.001 0.001 0.001 0.001 0.001 0.001 0.001 0.001 0.001 0.001 0.001 0.001 0.001 0.001 0.001 0.001 0.001 0.001 0.001 0.001 0.001 0.001 0.001 0.001		
Mixture25_barcode25	[('Omicron', 0.9690000000000001), ('Other', 0.028999999999999908), ('Delta', 0.001), ('Alpha', 0.001)]	BA.5.5 BA.5 Other BA.5.1.17 BA.5.3.2 B.3 BA.5.8 B.4 BA.5.1.2 BA.5.10.1 BA.5.2.4 BE.1.4.1 BU.1 AY.17 B.1.1.432 B.1.1.434 B.1.146 B.1.409 B.23 BA.5.1.15 BA.5.1.21 BA.5.1.22 BA.5.1.26 BA.5.1.3 BA.5.1.30 BA.5.1.33 BA.5.11 BA.5.2.34 BA.5.2.37 BA.5.2.39 BA.5.2.53 BA.5.2.57 BA.5.2.8 BA.5.3.4 BA.5.5.1 BA.5.5.2 BA.5.6.1 BE.10 BE.12 BF.27 BF.36 BK.1 BV.1 BW.1.1.2 BZ.2 CL.1 CP.8 CQ.1.1 Q.4 XAJ XBT	0.799 0.118 0.018999999999999906 0.004 0.004 0.003 0.003 0.002 0.002 0.002 0.002 0.002 0.002 0.001 0.001 0.001 0.001 0.001 0.001 0.001 0.001 0.001 0.001 0.001 0.001 0.001 0.001 0.001 0.001 0.001 0.001 0.001 0.001 0.001 0.001 0.001 0.001 0.001 0.001 0.001 0.001 0.001 0.001 0.001 0.001 0.001 0.001 0.001 0.001 0.001 0.001		
Mixture26_barcode26	[('Omicron', 0.961), ('Other', 0.03500000000000003), ('A', 0.002), ('BA.2.75* [Omicron (BA.2.75.X)]', 0.001), ('Alpha', 0.001)]	BA.4.1 BA.4 Other BA.5 BA.2.46 XAJ XAP B.4 BA.4.2 A.27 A.28 B.1.1.434 B.1.619 B.1.620 B.23 B.39 BA.2.16 BA.2.2 BA.2.3.14 BA.2.35 BA.2.8 BA.2.9.1 BA.4.3 BA.4.4 BA.4.7 BA.5.1.9 BA.5.5.2 BA.5.8 BV.1 BW.1.1 CN.2 CV.1 Q.7 XAS XAZ XW	0.691 0.222 0.028000000000000025 0.011 0.006 0.006 0.005 0.002 0.002 0.001 0.001 0.001 0.001 0.001 0.001 0.001 0.001 0.001 0.001 0.001 0.001 0.001 0.001 0.001 0.001 0.001 0.001 0.001 0.001 0.001 0.001 0.001 0.001 0.001 0.001 0.001		
Mixture27_barcode27	[('Omicron', 0.97), ('Other', 0.027000000000000017), ('A', 0.002), ('Alpha', 0.001)]	BA.4.1 BA.4 BA.5 Other XAJ B.1.1.161 B.4 BA.2.9.7 BA.4.2 BE.1.4.1 A.27 A.28 B.1.1.311 B.1.1.434 B.1.1.486 B.1.1.519 B.1.561 B.23 B.3 B.39 B.6 BA.2.2 BA.2.3.12 BA.2.3.15 BA.2.3.2 BA.2.35 BA.2.39 BA.2.41 BA.2.44 BA.2.48 BA.2.62 BA.2.70 BA.2.9.1 BA.4.1.8 BA.4.4 BA.4.7 BA.5.1.33 BA.5.1.9 BA.5.5.2 BE.1.3 BF.7.13.2 BW.1.1 L.3 Q.4 XAS XAZ XB	0.688 0.235 0.011 0.010000000000000009 0.007 0.003 0.003 0.002 0.002 0.002 0.001 0.001 0.001 0.001 0.001 0.001 0.001 0.001 0.001 0.001 0.001 0.001 0.001 0.001 0.001 0.001 0.001 0.001 0.001 0.001 0.001 0.001 0.001 0.001 0.001 0.001 0.001 0.001 0.001 0.001 0.001 0.001 0.001 0.001 0.001 0.001 0.001		
Mixture28_barcode28	[('Other', 0.943), ('Omicron', 0.05400000000000003), ('A', 0.003)]	Other XAJ BA.2.29 BA.2.46 BA.2.54 BA.2.18 BA.2.25 BA.2.31 BA.2.63 BA.2.8 A.1 A.27 A.3 B.1.404 B.1.620 B.3 B.39 B.40 BA.2.10.1 BA.2.16 BA.2.2 BA.2.26 BA.2.3.17 BA.2.3.4 BA.2.32 BA.2.35 BA.2.44 BA.2.50 BA.2.62 BA.2.65 BA.2.70 BA.2.9.7 BA.4.1.1 BA.4.7 BA.5.1.33 BA.5.1.9 BA.5.2.39 BA.5.8 BE.1.4.1 BW.1.1 CK.2.1.1 CL.1 XAZ XE	0.938 0.009 0.003 0.003 0.003 0.002 0.002 0.002 0.002 0.002 0.001 0.001 0.001 0.001 0.001 0.001 0.001 0.001 0.001 0.001 0.001 0.001 0.001 0.001 0.001 0.001 0.001 0.001 0.001 0.001 0.001 0.001 0.001 0.001 0.001 0.001 0.001 0.001 0.001 0.001 0.001 0.001 0.001 0.001		
Mixture29_barcode29	[('Omicron', 0.8250000000000002), ('Other', 0.1739999999999999), ('A', 0.001)]	BA.4.1 BA.2.12.1 BA.5.5 Other BA.4 BA.5.3 BA.5 XAJ BA.2.18 BE.1 BA.2.46 BA.2.40.1 BA.2.63 BA.2.68 BA.2.29 BA.2.51 BA.2.70 BA.5.1.26 BA.5.3.2 B.3 BA.2.1 BA.2.25 BA.2.34 BA.2.62 BA.4.7 BA.5.1.22 BA.5.2.12 A.28 B.1.1.434 B.23 B.4 BA.2.2 BA.2.26 BA.2.3.12 BA.2.3.17 BA.2.32 BA.2.35 BA.2.39 BA.2.44 BA.2.50 BA.2.65 BA.2.71 BA.2.72 BA.2.8 BA.2.9.4 BA.2.9.7 BA.4.1.1 BA.4.1.8 BA.4.2 BA.4.4 BA.5.1.16 BA.5.1.9 BA.5.11 BA.5.2.33 BA.5.2.37 BA.5.2.4 BA.5.2.8 BA.5.5.2 BA.5.5.3 BA.5.6.4 BA.5.8 BA.5.9 BE.1.1.1 BE.1.4.1 BE.3 BE.4.2 BF.27 BF.7.4.2 BG.5 BK.1 BQ.1.20 BW.1 BZ.2 CL.1 CP.8 DE.1 DG.1 L.3 XAZ XE	0.271 0.187 0.175 0.1679999999999999 0.029 0.023 0.019 0.015 0.006 0.006 0.005 0.004 0.004 0.004 0.003 0.003 0.003 0.003 0.003 0.002 0.002 0.002 0.002 0.002 0.002 0.002 0.002 0.001 0.001 0.001 0.001 0.001 0.001 0.001 0.001 0.001 0.001 0.001 0.001 0.001 0.001 0.001 0.001 0.001 0.001 0.001 0.001 0.001 0.001 0.001 0.001 0.001 0.001 0.001 0.001 0.001 0.001 0.001 0.001 0.001 0.001 0.001 0.001 0.001 0.001 0.001 0.001 0.001 0.001 0.001 0.001 0.001 0.001 0.001 0.001 0.001 0.001 0.001 0.001 0.001		
Mixture30_barcode30	[('Omicron', 0.863), ('Other', 0.13599999999999982), ('Delta', 0.001)]	BA.4.1 BF.1 Other BA.2.12.1 BA.2.12 BA.4 BA.5 XAJ BA.5.11 BA.2.25 BA.2.70 BA.2.18 BA.2.46 BA.5.8 B.39 BA.2.2 BA.2.40.1 BA.5.5.2 BU.1 AY.17 B.4 BA.2.1 BA.2.13.1 BA.2.16 BA.2.26 BA.2.31.1 BA.2.32 BA.2.35 BA.2.39 BA.2.44 BA.2.62 BA.2.63 BA.2.8 BA.4.1.6 BA.4.1.8 BA.4.2 BA.4.3 BA.4.7 BA.5.1.9 BA.5.10.1 BA.5.2.39 BE.1.2.1 BE.1.4.1 BE.3 BF.15 BF.20 BF.26 BF.27 BG.2 BG.5 BQ.1.2.1 BW.1.1 BZ.2 CK.2.1.1 CP.8 CQ.1.1 DL.1 XAS XAZ	0.399 0.178 0.1329999999999998 0.095 0.059 0.035 0.015 0.01 0.006 0.005 0.005 0.004 0.003 0.003 0.002 0.002 0.002 0.002 0.002 0.001 0.001 0.001 0.001 0.001 0.001 0.001 0.001 0.001 0.001 0.001 0.001 0.001 0.001 0.001 0.001 0.001 0.001 0.001 0.001 0.001 0.001 0.001 0.001 0.001 0.001 0.001 0.001 0.001 0.001 0.001 0.001 0.001 0.001 0.001 0.001 0.001 0.001 0.001 0.001		
Mixture31_barcode31	[('Other', 0.4730000000000001), ('Alpha', 0.137), ('Iota', 0.118), ('Gamma', 0.117), ('Delta', 0.07800000000000001), ('Omicron', 0.07400000000000001), ('A', 0.001), ('Beta', 0.001), ('Lambda', 0.001)]	Other B.1.1.161 B.1.1.7 B.1.526 P.1 BA.1 AY.16 P.1.16 AY.54 P.1.10 B.1.371 B.4 P.1.13 AY.16.1 AY.30 B.1.1.153 B.1.465 BA.1.16.1 P.1.14 A.27 AY.13 AY.17 AY.42 AY.47 AY.51 AY.52 AY.53 AY.78 B.1.1.198 B.1.1.232 B.1.1.307 B.1.1.374 B.1.1.376 B.1.1.420 B.1.1.70 B.1.110 B.1.126 B.1.214.2 B.1.221 B.1.324 B.1.351.3 B.1.356 B.1.362 B.1.377 B.1.409 B.1.509 B.1.517 B.1.561 B.1.568 B.1.617 B.1.619 B.1.620 B.1.626 B.1.9 B.40 BA.1.10 BA.1.14.1 BA.1.15 BA.1.5 BC.1 BD.1 C.37.1 D.2 P.1.10.1 P.1.15 P.1.17.1 Q.1 Q.4	0.272 0.164 0.135 0.118 0.093 0.066 0.059 0.011 0.007 0.005 0.003 0.003 0.003 0.002 0.002 0.002 0.002 0.002 0.002 0.001 0.001 0.001 0.001 0.001 0.001 0.001 0.001 0.001 0.001 0.001 0.001 0.001 0.001 0.001 0.001 0.001 0.001 0.001 0.001 0.001 0.001 0.001 0.001 0.001 0.001 0.001 0.001 0.001 0.001 0.001 0.001 0.001 0.001 0.001 0.001 0.001 0.001 0.001 0.001 0.001 0.001 0.001 0.001 0.001 0.001 0.001 0.001 0.001		
Mixture32_barcode32	[('Omicron', 0.5610000000000002), ('Other', 0.22999999999999998), ('Alpha', 0.123), ('Iota', 0.083), ('Beta', 0.001), ('BA.2.75* [Omicron (BA.2.75.X)]', 0.001), ('Gamma', 0.001)]	BA.4.1 B.1.1.7 B.1.1.161 Other XAJ B.1.526 BF.1 BA.1.9 BA.2.12 XAP XAR XM BF.20 BA.2.37 BA.2.46 BA.2.70 BA.4.3 BF.2 B.1.1.153 B.1.1.216 B.3 BA.1.15.3 BA.1.24 BA.2.63 BA.2.68 BA.5.5.2 BF.27 B.1.1.369 B.1.221 B.1.351.3 B.1.356 B.1.361 B.1.362 B.1.377 B.1.453 B.1.469 B.1.544 B.1.568 B.1.619 B.23 B.4 BA.1.13 BA.1.14.1 BA.1.17.2 BA.1.5 BA.2.16 BA.2.19 BA.2.2 BA.2.26 BA.2.3.15 BA.2.32 BA.2.39 BA.2.41 BA.2.5 BA.2.62 BA.2.65 BA.2.8 BA.2.9.4 BA.2.9.7 BA.4.1.1 BA.4.1.8 BA.4.7 BA.5.1.16 BA.5.1.26 BA.5.1.9 BA.5.10.1 BA.5.8 BC.1 BE.1.4.1 BF.1.1 BF.10 BF.21 BF.3.1 BF.40 BF.5 BG.5 BQ.1.2.1 CL.1 CV.1 P.1.17.1 Q.1 Q.4 Q.7 XB	0.187 0.12 0.105 0.10499999999999998 0.09 0.083 0.08 0.058 0.031 0.019 0.019 0.007 0.006 0.003 0.003 0.003 0.003 0.003 0.002 0.002 0.002 0.002 0.002 0.002 0.002 0.002 0.002 0.001 0.001 0.001 0.001 0.001 0.001 0.001 0.001 0.001 0.001 0.001 0.001 0.001 0.001 0.001 0.001 0.001 0.001 0.001 0.001 0.001 0.001 0.001 0.001 0.001 0.001 0.001 0.001 0.001 0.001 0.001 0.001 0.001 0.001 0.001 0.001 0.001 0.001 0.001 0.001 0.001 0.001 0.001 0.001 0.001 0.001 0.001 0.001 0.001 0.001 0.001 0.001 0.001 0.001 0.001 0.001 0.001		
Mixture33_barcode33	[('Other', 0.998), ('A', 0.002)]	Other A.27 A.28 B.1.1.153 B.4	0.996 0.001 0.001 0.001 0.001		
Mixture34_barcode34	[('Alpha', 0.967), ('Other', 0.02800000000000002), ('A', 0.005)]	B.1.1.7 Other B.3 Q.3 A.2.5.2 A.21 A.27 A.28 A.3 B.1.1.161 B.1.1.241 B.1.1.279 B.1.1.434 B.1.1.486 B.1.146 B.1.311 B.1.404 B.1.544 B.1.561 B.1.568 B.4 Q.4 Q.7	0.963 0.013000000000000012 0.003 0.002 0.001 0.001 0.001 0.001 0.001 0.001 0.001 0.001 0.001 0.001 0.001 0.001 0.001 0.001 0.001 0.001 0.001 0.001 0.001		
Mixture35_barcode35	[('Gamma', 0.967), ('Other', 0.03100000000000002), ('A', 0.002)]	P.1 Other B.1.1.161 P.1.13 P.1.17 B.1.1.153 P.1.14 A.27 A.3 B.1.1.434 B.1.221 B.3 C.16 D.2 P.1.17.1	0.958 0.019000000000000017 0.005 0.003 0.003 0.002 0.002 0.001 0.001 0.001 0.001 0.001 0.001 0.001 0.001		
